{
  "schema": "run_bundle/v0",
  "run_id": "run-ecbdd4d3b5180f",
  "status": "completed",
  "inputs": {
    "raw_data": {
      "path": "tests/fixtures/xrdml/cu_quartz.xrdml",
      "original_sha256": "d3906c9ede9309512adaffada7067b3b97fbb4f35144caaf330d8dee2b6285eb",
      "format": "XRDML"
    },
    "sample_name": "SiO2 quartz (COD 1009000)",
    "sample_name_sha256": "6dd6475f7942ed0ef7ae03bc9fa412ffd282214db2892215a479c66e7ca797ef"
  },
  "controlled_versions": {
    "calibration_id": "cal-967c5da10ad2",
    "calibration_sha256": null,
    "catalog_version": "340127a8343e",
    "policy_version": "policy/0.1.0",
    "gsasii_version": "5.6.3",
    "vocabulary_version": null
  },
  "environment": {
    "python": "3.13.7",
    "platform": "macOS-15.6.1-x86_64-i386-64bit-Mach-O",
    "package_versions": {
      "numpy": "2.5.2"
    }
  },
  "plan": {
    "plan_sha256": "809758f29e403ab77b4b86766da107fe68ebc5413d009ba63f12fac137434c0e",
    "recipe_key": "fingerprint-only-m1",
    "approval": {
      "mode": "policy-delegated",
      "policy_version": "policy/0.1.0",
      "expert": null,
      "approved_at": null
    }
  },
  "checkpoints": [
    {
      "stage": "ingest",
      "gpx_path": "",
      "metrics": {
        "parsed": true
      }
    },
    {
      "stage": "calibration",
      "gpx_path": "",
      "metrics": {
        "resolution": "resolved",
        "calibration_id": "cal-967c5da10ad2"
      }
    },
    {
      "stage": "hypothesis",
      "gpx_path": "",
      "metrics": {
        "n_candidates": 14,
        "top_similarity": 1.0,
        "margin": 0.925729,
        "raw_margin": 0.925729
      }
    },
    {
      "stage": "verdict",
      "gpx_path": "",
      "metrics": {
        "verdict": "supported",
        "reasons": [
          "calibration resolved (cal-967c5da10ad2); top candidate separated from the best other phase family by margin 0.926"
        ]
      }
    }
  ],
  "verdicts": [
    {
      "phase_family": "GaAsO4 (quartz homeotype)",
      "cod_ids": [],
      "status": "supported",
      "context_only": false,
      "evidence": {
        "evidence_level": "fingerprint-only",
        "top_similarity": 1.0,
        "margin": 0.925729,
        "raw_margin": 0.925729,
        "matched_peaks": 30,
        "top_peaks": [
          {
            "tth": 25.8489,
            "d": 3.4437,
            "height": 150397788.94521874,
            "fwhm": 0.14
          },
          {
            "tth": 37.801,
            "d": 2.3779,
            "height": 37510771.13851402,
            "fwhm": 0.08
          },
          {
            "tth": 20.5231,
            "d": 4.3238,
            "height": 30915249.596392885,
            "fwhm": 0.1
          },
          {
            "tth": 41.7339,
            "d": 2.1624,
            "height": 26844245.882822756,
            "fwhm": 0.1
          },
          {
            "tth": 39.3678,
            "d": 2.2868,
            "height": 23934399.370103173,
            "fwhm": 0.1
          }
        ]
      }
    }
  ],
  "evidence_separation": {
    "measured": "",
    "deterministic_checks": "",
    "ai_interpretation": ""
  },
  "artifacts": [
    {
      "kind": "report-json",
      "path": "data/spike8/results/compare/cu_quartz.bundle.json"
    }
  ],
  "verification": {
    "recipe": "refinement-verify-v1",
    "policy_version": "1.0",
    "evidence_level": "fingerprint + refinement",
    "confirmed_family": "GaAsO4 (quartz homeotype)",
    "separation": 0.98008,
    "candidates": [
      {
        "family": "GaAsO4 (quartz homeotype)",
        "cod_id": 1009000,
        "rwp": 0.0,
        "rexp": 0.001272,
        "gof": 3e-05,
        "n_points": 6155,
        "n_params": 5,
        "converged": true,
        "cell": null
      },
      {
        "family": "TiO2 (rutile)",
        "cod_id": 1010942,
        "rwp": 0.98008,
        "rexp": 0.001272,
        "gof": 770.254093,
        "n_points": 6155,
        "n_params": 5,
        "converged": true,
        "cell": null
      }
    ],
    "consistent_with_fingerprint": true
  }
}